title,description,published_at,source
Here's how much Memphis athletics has spent in revenue share payments,"For the first time, we have a look at how much Memphis has spent on revenue share payments to athletes.",2026-02-26T19:57:16Z,Commercial Appeal
The 8 best sports TV shows of all time,‘Heated Rivalry’ is just the latest show to use a sports hook to win audiences,2026-02-26T19:25:04Z,The Week Magazine
Pelé’s 1966 World Cup jacket draws new fans after Bad Bunny wears it at concerts in Brazil,He borrowed it from a collector’s soccer shop.,2026-02-26T18:49:09Z,Boston Herald
Mass graves found scattered around Mexican soccer stadium slated to host World Cup games,Hundreds of bags of human remains were recently found in makeshift graves in the Mexican city at the heart of the startling wave of violence over the killing of a cartel boss.,2026-02-26T18:41:23Z,New York Post
Spanish soccer league wants to try again in the US and resurrect overseas game,The Spanish soccer league wants to resurrect plans to stage a regular-season game in the United States. La Liga president Javier Tebas said Thursday that he was not giving up on taking a top Spanish match abroad after controversial plans to play outside Miami…,2026-02-26T18:20:47Z,Yahoo Entertainment
Magliano Updates Veja’s Soccer-inspired Panenka Sneaker in Newest Collab,"Magliano has updated the Veja Panenka sneaker, a soccer-inspired silhouette, for its newest footwear collaboration. The shoe comes in three colorways.",2026-02-26T18:04:02Z,WWD
"The five most noteworthy NWSL kits of 2026: Disco balls, a Lady Liberty fever dream and more","This year’s crop of tops draw on Venus flytraps, cherry blossoms and classic soccer jersey designs – to varying degrees of success",2026-02-26T17:59:04Z,Yahoo Entertainment
"Despite Mexico violence, FIFA president Gianni Infantino says World Cup will be a 'party'",FIFA President Gianni Infantino says he's confident the World Cup will be 'a party' in Mexico despite the recent outbreak of violence.,2026-02-26T17:45:44Z,USA Today
Andrews rewarded with six-year contract at Brentford,Keith Andrews has signed a six-year contract with Brentford after a dream start to his managerial career in the Premier League.,2026-02-26T17:34:41Z,RTE
"Cristiano Ronaldo net worth: How much money soccer star has made in career earnings, endorsements and more","Cristiano Ronaldo is not just one of the most famous football players of the current generation, but one of the greatest the sport has ever seen.",2026-02-26T17:25:19Z,Sporting News
Ryan Reynolds’ Wrexham faces financial hit from collapsed broker,"Wrexham AFC, the soccer club controlled by Ryan Reynolds, is likely to lose some of its money held at a collapsed U.K. brokerage. Read here",2026-02-26T16:58:05Z,Financial Post
Cristiano Ronaldo buys 25% stake in Spanish soccer club Almeria,"Portuguese soccer icon Cristiano Ronaldo purchased a 25% ownership stake in Spanish club Almeria, the La Liga 2 team announced Thursday.",2026-02-26T16:36:37Z,UPI.com
